{
  "$schema": "https://json-schema.org/draft/2020-12/schema",
  "$id": "plugin://char-creator/characters",
  "type": "object",
  "required": ["id", "name"],
  "properties": {
    "id": { "type": "string", "minLength": 1 },
    "sessionId": { "type": "string", "minLength": 1 },
    "name": { "type": "string", "minLength": 1 },
    "type": { "type": "string", "minLength": 1 },
    "description": { "type": "string" },
    "fields": {},
    "version": { "type": "integer", "minimum": 1 },
    "createdAt": { "type": "string", "minLength": 1 },
    "updatedAt": { "type": "string", "minLength": 1 }
  },
  "additionalProperties": true
}
